id,data_reclamacao,canal,texto_reclamacao,produto,status,categoria_oculta_gabarito
REC-2026-00001,2026-02-28,Ouvidoria,"Ouvidoria, pelo amor de Deus, eu não sei mais o que fazer! Eu estou com o coração na mão, desesperado mesmo. Eu não sou de ficar reclamando, não, mas a situação está feia e eu não sei para quem mais pedir ajuda.

Olha, esses dias, eu recebi uma ligação no meu telefone fixo. A pessoa do outro lado, uma moça muito educada, disse que era do banco. Ela falou que tinha uma compra estranha no meu cartão de crédito, que eu nunca fiz. Uma compra alta, dessas de loja de eletrônico, sabe? Ela falou que era para eu não me preocupar, que eles iam resolver, mas que precisava da minha ajuda para ""confirmar uns dados"" e ""cancelar a compra errada"".

Eu, na minha inocência, pensei: ""Poxa, que bom que o banco está me avisando!"". Eu não sou muito bom com essas coisas de internet e aplicativo de banco, então achei que era o jeito certo de fazer. A moça falava tão direitinho, parecia mesmo do banco. Ela me pediu para confirmar uns números do cartão, não o número todo, mas uns pedacinhos, e um código que tem atrás. Eu fiquei um pouco inseguro, mas ela insistiu que era para minha segurança, para bloquear o gasto que não era meu. Ela me garantiu que era tudo sigiloso e que ninguém ia ter acesso a nada.

Depois de uns dias, meu Deus do céu, quando fui olhar a fatura do cartão, veio umas compras que eu não fiz! Não foi só aquela que a moça falou, foram outras! Umas em lojas que eu nunca pisei, umas coisas que eu nem sei o que são. O valor está altíssimo! Eu quase caí para trás quando vi. Eu não sei como isso aconteceu, eu juro que fiz tudo que a moça do banco pediu para *resolver* o problema, não para criar mais um.

Eu tentei ligar para o banco, para aquele número que vem atrás do cartão, sabe? Mas é uma complicação danada! Aperta um, aperta dois, a musiquinha não para. Eu fico horas e horas no telefone e não consigo falar com ninguém que entenda o meu problema de verdade. Aqueles atendimentos automáticos só me deixam mais confuso e nervoso. Eu não sou um garoto para entender tudo isso. Eu só queria meu dinheiro de volta, ou pelo menos que parassem de cobrar essas coisas que não comprei. Eu sou aposentado, meu dinheiro é contadinho, não posso ficar com esse prejuízo!

Eu estou com tanto medo, Ouvidoria. Com medo de usarem meu nome, de fazerem mais dívidas, de eu não conseguir pagar. Eu não sei mais o que fazer, a quem recorrer. Vocês são minha última esperança. Por favor, me ajudem a entender o que aconteceu e a resolver essa bagunça no meu cartão. Eu só quero que essa confusão pare e que meu dinheiro não seja perdido. Por favor, me digam o que eu tenho que fazer. Eu preciso de ajuda, de verdade.",Cartão de Crédito,Em análise,Fraude/Segurança
REC-2026-00002,2026-12-13,Redes Sociais,"A paciência se esgotou. É com um misto de revolta e absoluta incredulidade que me dirijo a este canal público para denunciar a conduta absolutamente inaceitável e, francamente, vexatória desta instituição. Não se trata de um mero erro isolado; é um padrão de desrespeito e negligência que já ultrapassou todos os limites do tolerável e que clama por uma resolução imediata.

Há meses, para ser preciso, desde o início de março deste ano, tenho sido importunado por uma série de cobranças indevidas que surgem, de forma persistente e injustificada, em meu extrato. O detalhe crucial, e que torna a situação ainda mais absurda, é que *não possuo nenhum produto ativo, absolutamente nenhum serviço contratado* que justifique sequer um único centavo desses débitos. Após um encerramento formal e completo de todas as minhas relações comerciais com a empresa, imaginei que estaria finalmente livre de qualquer vínculo. Que ingenuidade a minha! Em vez disso, fui brindado com uma sequência de débitos referentes a supostas ""taxas de manutenção de cadastro"" ou ""serviços administrativos"" que sequer consigo identificar a que se referem.

Inúmeras, e repito, *inúmeras* foram as tentativas de resolução desta aberração. Foram seis ligações para o serviço de atendimento ao cliente, cada uma delas resultando em promessas vazias de ""análise da situação"" ou ""estorno em até X dias úteis"", que, evidentemente, nunca se concretizaram. Tenho cinco protocolos de atendimento anotados, com datas e nomes dos atendentes que, em sua maioria, demonstraram total despreparo para lidar com o problema ou, o que é ainda pior, um descaso inadmissível com a gravidade da situação. Enviei e-mails detalhados, utilizei o chat online e, ainda assim, a resposta é sempre a mesma: inércia, evasivas ou a promessa de um retorno que jamais acontece. Cada contato é um novo calvário, um desgaste emocional e de tempo que esta instituição se recusa a ressarcir.

É inconcebível que, em pleno século XXI, uma empresa do porte de vocês persista em cobrar por algo que simplesmente não existe, ignorando sumariamente as solicitações claras e repetidas de seus ex-clientes. Esta conduta não é apenas um transtorno; é um ilícito consumerista flagrante, uma apropriação indébita de valores que me pertencem, e uma afronta direta aos direitos mais básicos e inalienáveis do consumidor. A inércia e a recalcitrância de vocês em resolver um problema tão simples me forçam a questionar a integridade dos processos internos e, sobretudo, a ética por trás de tais práticas. A competência para gerir o mínimo, que é a cessação de cobranças sem lastro, parece inexistente.

Deixo claro que a paciência já se exauriu por completo. Não estou mais disposto a gastar um minuto sequer do meu tempo em tentativas infrutíferas de contato pelos canais convencionais. O presente comunicado serve como o registro derradeiro de minha insatisfação e uma advertência formal e irrefutável: exijo a IMEDIATA cessação de todas e quaisquer cobranças indevidas, o estorno INTEGRAL e corrigido de todos os valores já debitados de forma abusiva e uma retratação formal pela inconveniência, pelo transtorno e pelos danos morais e materiais causados.

A falha em resolver esta situação de forma URGENTE e definitiva, com comprovação inequívoca das providências tomadas, levará à adoção de todas as medidas cabíveis para a plena reparação dos meus direitos e dos prejuízos incorridos. Não hesitaremos em prosseguir com as diligências necessárias para que esta instituição seja devidamente responsabilizada por sua conduta negligente e abusiva. A bola está no campo de vocês, e o tempo para agir está se esgotando rapidamente. Este é o último aviso antes de outras instâncias serem acionadas.",,Em análise,Cobrança Indevida
REC-2026-00003,2026-12-20,Ouvidoria,Pq tá vindo cobrança de empréstimo q não fiz? Resolvam logo isso.,Empréstimo,Aberta,Cobrança Indevida
REC-2026-00004,2026-10-17,SAC,"Ai, sac, tô desesperada! Tão me cobrando um dinheiro errado na minha conta, não sei o que fazer, me ajuda pelo amor de Deus!",Conta Corrente,Em análise,Cobrança Indevida
REC-2026-00005,2026-09-17,Banco Central,"Banco Central, vocês precisam olhar isso direito! É um absurdo o que esses bancos fazem com a gente que precisa de um empréstimo. Eles vendem uma coisa, mas na hora de pagar as taxas aparecem do nada, um monte de coisa que não explicam direito. Isso é só pra enganar o trabalhador e vocês não fazem nada?",Empréstimo,Aberta,Produto/Serviço
REC-2026-00006,2026-07-05,Redes Sociais,"Atenção, FinanMais S.A. Esta não é uma mera reclamação de cliente insatisfeito. É uma notificação pública, redigida por um profissional, expondo a conduta de sua instituição. Represento a Sra. Marta Ribeiro, cidadã que, como tantos outros, confiou em sua promessa de um serviço bancário transparente e eficiente, apenas para ser confrontada com uma sequência de eventos que beira o abuso e a má-fé.

No dia 14 de março do corrente ano, minha cliente foi abordada com uma oferta de cartão de crédito que prometia condições específicas: anuidade zero para sempre e um limite de crédito inicial de R$ 5.000,00, tudo isso veiculado por meio de um anúncio em sua própria plataforma digital e confirmado por um de seus prepostos no atendimento via chat. A Sra. Ribeiro, confiando na reputação que vocês arduamente tentam construir, aceitou a proposta, com a convicção de que os termos seriam rigorosamente cumpridos.

Ocorre que, para sua surpresa e desapontamento, após a aprovação e recebimento físico do cartão, as condições acordadas foram sumariamente desconsideradas. A primeira fatura apresentou uma cobrança de anuidade no valor de R$ 35,00, contrariando explicitamente a promessa de anuidade zero. Além disso, o limite de crédito disponibilizado foi de apenas R$ 1.500,00, uma discrepância inaceitável em relação ao valor ofertado inicialmente e um claro indício de publicidade enganosa.

Imediatamente, a Sra. Ribeiro tentou resolver a questão pelos canais de atendimento que vocês disponibilizam. Foram nada menos que cinco tentativas, com os protocolos de atendimento [inventar um número, ex: 20240315-001, 20240315-002, 20240316-001, 20240318-001, 20240320-001], estendendo-se pelos dias 15, 16, 18 e 20 de março. Em todas as ocasiões, a resposta foi evasiva, os atendentes se mostraram despreparados e a cada contato um novo prazo era prometido para a ""análise"" da situação, prazo este que nunca foi cumprido, tampouco gerou qualquer resolução efetiva. A cobrança da anuidade permaneceu, e o limite de crédito prometido nunca foi restabelecido, forçando minha cliente a um endividamento desnecessário ou à inviabilidade de uso do cartão para suas necessidades prementes.

Este comportamento não é apenas uma falha operacional; é uma demonstração de desrespeito flagrante ao consumidor, uma violação dos princípios de boa-fé contratual e uma prática que mina a confiança de quem opta por seus serviços. A Sra. Marta Ribeiro não apenas teve suas expectativas frustradas, mas foi submetida a um desgaste emocional e perda de tempo incalculáveis tentando corrigir um erro que é de responsabilidade exclusiva de sua empresa.

Informo-lhes, de forma inequívoca, que esta situação não será tolerada. Exijo, em nome de minha cliente, a imediata retificação de todas as condições do cartão de crédito para que correspondam exatamente ao que foi ofertado e prometido, incluindo o estorno integral da anuidade cobrada indevidamente e a readequação do limite de crédito. Exijo também uma retratação formal e um plano de ação claro para evitar que outros consumidores sejam lesados por práticas semelhantes.

Não se enganem. Esta exposição nas redes sociais é apenas o primeiro passo. A Sra. Ribeiro e eu estamos preparados para escalar este caso por todas as vias cabíveis, garantindo que a FinanMais S.A. seja responsabilizada por sua conduta e que sua reputação pública reflita a qualidade real de seus serviços e o tratamento dispensado a seus clientes. A inércia ou a recusa em resolver esta questão de forma rápida e justa resultará em consequências muito mais amplas do que uma simples má avaliação em um site de reclamações.",Cartão de Crédito,Resolvida,Produto/Serviço
REC-2026-00007,2026-05-19,Redes Sociais,"Ô, vcs aí, qual é a fita de cancelar minha conta corrente assim, do nada? Num tô entendendo é nada, isso tá me atrapalhando demais e é uma zoeira. Quero uma explicação e que resolvam essa treta logo, sem caô!",Conta Corrente,Em análise,Cancelamento
REC-2026-00008,2026-06-15,Ouvidoria,Escrevo para registrar uma reclamação formal referente a uma cobrança indevida em meu cartão de crédito. O valor em questão não é reconhecido por mim e exige imediata apuração. Solicito o estorno integral do montante e a regularização de meu extrato com a máxima urgência.,Cartão de Crédito,Aberta,Cobrança Indevida
REC-2026-00009,2026-10-19,Redes Sociais,Reclamo formalmente da qualidade do atendimento recebido para meu cartão de crédito. As interações foram ineficazes e a questão permanece sem resolução. Espero uma solução célere para a situação.,Cartão de Crédito,Em análise,Atendimento
REC-2026-00010,2026-04-19,Banco Central,"Banco Central, eu simplesmente não consigo acreditar no absurdo que estou passando com o Banco Capital S.A. Isso é um escândalo, uma afronta ao cliente, e eu me recuso a aceitar. Eu, Augusto Valério, sou cliente *há décadas* desse banco, e não um cliente qualquer, ok? Meu gerente de relacionamento sabe muito bem quem eu sou, o volume de transações que eu faço, os investimentos que mantenho lá. Eu sou um cliente VIP, daqueles que o banco *deveria* tratar com a máxima prioridade e respeito.

E o que acontece? Eles me jogam uma cobrança indevida na conta corrente! Uma taxa de ""serviços de manutenção"" no valor de R$ 350,00, lançada no dia 15 de maio, sem aviso, sem justificativa, sem *nada*. Minha conta é uma conta de relacionamento de alta performance, com isenção total de taxas por contrato, por volume de aplicações! Isso é uma piada de mau gosto? Eles estão testando minha paciência ou a minha inteligência? Já tive que perder meu tempo precioso tentando resolver essa palhaçada. Falei com minha gerente, a Sra. Roberta, que até então era super solícita. Agora parece que a prioridade dela é outra. Me deu um monte de desculpas esfarrapadas e não resolveu nada! Depois me jogou para o atendimento geral, para o SAC, como se eu fosse um cliente comum, desses que ligam para reclamar de tarifa de saque. É um desrespeito total!

A questão não são os R$ 350,00 em si, claro que não. Meu patrimônio não se abala com isso. A questão é o princípio! É a falta de ética, a tentativa de me extorquir, de me passar para trás, a um cliente da minha importância. Onde está a segurança? Onde está a confiabilidade de uma instituição que age assim com seus melhores clientes? Isso me causa um transtorno gigantesco. Tive que revisar extratos, ligar, esperar, me estressar. Eu tenho coisas muito mais importantes para fazer do que ficar caçando cobranças indevidas do meu banco! Minha agenda é apertada, meu tempo é valioso.

Eu estou desesperado por uma intervenção. Eu conto com o Banco Central para colocar um freio nessa irresponsabilidade. Eu não vou aceitar essa cobrança. Já avisei meus advogados. Se isso não for resolvido imediatamente, e por ""imediatamente"" eu quero dizer *agora*, sem mais enrolação, o Banco Capital S.A. vai ter que lidar com as consequências legais. Eu levarei isso ao Procon, abrirei um processo judicial que fará com que esses R$ 350,00 pareçam troco de bala. Tenho os recursos e a determinação para ir até o fim, e farei questão de que meu caso sirva de exemplo para que outros clientes VIP como eu não sejam desrespeitados dessa maneira. Eu preciso que o Banco Central me ajude a fazer justiça e a mostrar a essa gente que eles não podem fazer o que quiserem com o dinheiro e a confiança de seus clientes. É pedir muito por um tratamento justo e de acordo com o meu status? Eu exijo uma solução definitiva e uma retratação imediata.",Conta Corrente,Em análise,Cobrança Indevida
REC-2026-00011,2026-01-06,Ouvidoria,"Ouvidoria, pelo amor de Deus, ou de quem quer que ainda se importe por aí!

Vim aqui de novo, porque a paciência que eu achei que tinha guardado pra aposentadoria já evaporou. É sobre o meu cartão de crédito, aquele que a empresa X me deu com tanta promessa de ""facilidade"" e ""conveniência"". Conveniência de pagar o que não devo, só se for!

A história é a mesma de sempre, mas parece que pra vocês ela é inédita a cada mês. Em janeiro, pra minha surpresa (ou não, vindo de vocês), apareceu na fatura uma tal de ""Tarifa de Serviços Premium"" no valor de R$ 29,90. Premium? Eu mal consigo pagar o básico, quem dirá serviços premium que eu nem sei o que são e, mais importante, NUNCA contratei! Achei que era um engano, um erro de sistema, sabe? A gente ainda tem esperança.

Liguei pra central de atendimento. Ah, a central de atendimento! Um paraíso de eficiência, com certeza. Fiquei uns 40 minutos na espera, ouvindo musiquinha desafinada e um robô que mais parecia estar me testando a sanidade. Quando finalmente consegui falar com um ser humano – que se chamava ""Atendente Virtual Plus Ultra Mega Giga"" ou algo assim –, expliquei a situação. A moça, com uma voz tão entediada que dava pra sentir o bocejo dela pelo telefone, disse que ia abrir uma contestação e que a cobrança seria estornada na próxima fatura. Fiquei aliviado. Que bobo eu fui.

Chegou a fatura de fevereiro. E lá estava ela, a minha velha amiga ""Tarifa de Serviços Premium"", sorrindo pra mim como um presente indesejado! E, pra adicionar uma pitada de emoção, o estorno prometido da fatura anterior? Sumido, evaporado, deve ter ido fazer companhia pra minha paciência. Liguei de novo. Mais 50 minutos na espera. Mais um atendente prometendo mundos e fundos, dizendo que ia ""agilizar"" o processo. Agilizar, pra vocês, deve significar deixar parado por mais tempo.

Agora, chegou a fatura de março. E adivinhem só? A ""Tarifa de Serviços Premium"" marcou presença novamente! Eu já estou esperando ela aparecer no meu extrato de imposto de renda, de tão fiel que ela é! Quer dizer, eu estou pagando por TRÊS meses uma coisa que eu não pedi, que me prometeram tirar e que continua lá, debochando da minha cara. É uma dedicação à cobrança indevida que merece um prêmio, de verdade. Talvez seja a ""Taxa de Inovação em Insistência de Cobrança Indevida"".

Olha, eu sou um trabalhador, meu CPF é 123.456.789-00, e eu me mato de trabalhar pra conseguir pagar minhas contas. Não pra financiar ""serviços premium"" imaginários de vocês. Vocês acham que eu imprimo dinheiro em casa? Ou que eu sou um colecionador de cobranças absurdas? Porque se for pra ser assim, me avisem, que eu troco de hobby.

Eu só quero que parem de me cobrar essa porcaria e estornem o que já me roubaram. Não é pedir muito, é? É o mínimo da decência. Mas pelo visto, decência é um serviço premium que vocês não oferecem pra clientes simples como eu. Se não resolverem isso aqui, acho que vou ter que começar a vender meu tempo de espera no telefone pra vocês, já que é o que mais gasto sendo cliente de vocês.

Aguardo uma solução de verdade, e não mais promessas vazias. Ou quem sabe na próxima fatura, além da tarifa, venha cobrando também a minha indignação.",Cartão de Crédito,Aberta,Cobrança Indevida
REC-2026-00012,2026-05-04,Redes Sociais,"É um absurdo a falta de segurança nos empréstimos de vocês! Tô indignado com essa palhaçada de golpe, exijo uma explicação AGORA!",Empréstimo,Resolvida,Fraude/Segurança
REC-2026-00013,2026-05-31,Ouvidoria,"Tô com uma cobrança indevida no meu empréstimo e preciso que resolvam isso urgente. Já paguei tudo certinho e agora apareceu um valor que eu não reconheço, maior erro. Tô perdendo a paciência, quero que tirem essa cobrança falsa da minha conta agora.",Empréstimo,Em análise,Cobrança Indevida
REC-2026-00014,2026-08-31,Banco Central,"Estou absolutamente chocado e ultrajado com a cobrança indevida que o Bradesco lançou na minha conta! Depois de anos como um cliente VIP, com um volume de movimentação que daria inveja a muita agência, ser tratado com essa falta de respeito e competência é um insulto pessoal. O Banco Central precisa resolver essa aberração *agora*, porque se eu tiver que acionar meu time jurídico, a dor de cabeça para o Bradesco e para quem permitiu isso será algo sem precedentes. É o cúmulo da incompetência e descaso!",,Em análise,Cobrança Indevida
REC-2026-00015,2026-12-26,Redes Sociais,"URGENTE E INADMISSÍVEL: FALHA DE SEGURANÇA CRÍTICA E FRAUDE NA CONTA CORRENTE DE MEU CLIENTE

É com a mais profunda indignação e um senso de urgência que dirijo esta reclamação a este canal, dada a flagrante e inaceitável falha nos protocolos de segurança da sua instituição que resultou em uma fraude explícita na conta corrente de meu cliente. A situação é tão revoltante quanto a morosidade e a ineficácia com que tem sido tratada até o momento.

Na última [Data inventada, ex: terça-feira, 14 de maio], o titular da conta, [Nome Fictício do Cliente, ex: Sr. Roberto Silva], foi vítima de uma sofisticada operação de phishing que culminou no acesso indevido à sua conta corrente. Embora meu cliente tenha sempre adotado as melhores práticas de segurança e jamais compartilhado suas credenciais, a vulnerabilidade do sistema de autenticação e a falta de filtros robustos por parte do [Nome da Instituição Financeira, ex: Banco Ágil] permitiram que criminosos efetuassem uma série de transações fraudulentas, esvaziando parte significativa de seu saldo. A sequência dos fatos é estarrecedora: um SMS falso, forjando-se como uma comunicação legítima do banco, direcionou o Sr. Silva a um site espelho que, de forma ardilosa, coletou dados de acesso. O que é absolutamente incompreensível é como a segurança transacional da sua plataforma não detectou um padrão de uso atípico e completamente dissonante do histórico do cliente, permitindo múltiplas transferências para contas desconhecidas em um curtíssimo espaço de tempo.

Meu cliente, ao perceber a anomalia através de notificações tardias, agiu com a máxima celeridade, entrando em contato imediato com a central de atendimento telefônico de sua instituição em [Hora aproximada, ex: menos de 10 minutos após a última transação suspeita]. A expectativa era de um bloqueio imediato das transações e uma resposta proativa para a recuperação dos valores. O que ele encontrou, contudo, foi um labirinto burocrático, atendentes que pareciam despreparados para lidar com a gravidade da situação e a promessa vaga de uma análise que, até agora, não produziu resultados concretos. É um escárnio com a boa-fé e a confiança depositada por anos em sua instituição. A cada minuto que passa sem uma resolução efetiva, a raiva e a frustração de meu cliente só aumentam, e a responsabilidade recai inteiramente sobre a inoperância do [Nome da Instituição Financeira, ex: Banco Ágil].

Exijo, de forma categórica e irrenunciável, a imediata reversão de todas as transações fraudulentas identificadas e a integral recomposição do saldo da conta corrente de meu cliente. Não admitiremos desculpas esfarrapadas ou tentativas de imputar a culpa ao consumidor. A falha de segurança é patente e a incapacidade de proteger o patrimônio de seus correntistas é um descrédito para qualquer instituição financeira que se preze.

O [Nome da Instituição Financeira, ex: Banco Ágil] tem a obrigação legal e moral de garantir a segurança dos fundos depositados em suas contas. A negligência demonstrada neste caso é inaceitável e coloca em xeque a reputação e a confiabilidade de seus serviços. Esteja ciente de que não hesitarei em tomar todas as medidas cabíveis para garantir que meu cliente seja devidamente ressarcido e que sua instituição seja responsabilizada por este grave incidente. A paciência esgotou-se. A resolução deve ser imediata e completa.",Conta Corrente,Em análise,Fraude/Segurança
REC-2026-00016,2026-04-09,Banco Central,"Banco Central, fui vítima de fraude em empréstimo e exijo providência já, senão a parada vai pro judicial e vocês vão ter que resolver essa bronca.",Empréstimo,Aberta,Fraude/Segurança
REC-2026-00017,2026-04-21,Redes Sociais,"Absurdo ter que vir aqui reclamar! Como cliente de longa data e com o volume de negócios que tenho com vocês, é inaceitável essa cobrança indevida no meu empréstimo. Espero que resolvam essa palhaçada imediatamente, sem eu ter que perder mais tempo com isso. Exijo que corrijam e me deem um retorno urgente.",Empréstimo,Em análise,Cobrança Indevida
REC-2026-00018,2026-02-21,Ouvidoria,Exijo explicações urgentes sobre a fraude no meu cartão de crédito! Estou em uma situação insustentável e a responsabilidade por esta falha recai sobre vocês.,Cartão de Crédito,Em análise,Fraude/Segurança
REC-2026-00019,2026-12-29,Ouvidoria,"Ouvidoria, pelo amor de Deus, esse meu cartão de crédito novo não funciona direito. Toda hora aparece uma mensagem esquisita no celular sobre ""atualizar dados"" ou ""validar token"" e eu não sei o que é isso, só sei que não consigo mais fazer minhas compras em paz. Eu só queria que meu cartão funcionasse como antes, sem tanta complicação de internet. Me ajudem a fazer essa tecnologia parar de me atrapalhar!",Cartão de Crédito,Em análise,Produto/Serviço
REC-2026-00020,2026-12-24,Ouvidoria,"Eu não aguento mais essa cobrança indevida do empréstimo! Já paguei essa porcaria e vocês continuam me infernizando. Resolvam isso logo, que eu não tenho tempo pra essa palhaçada!",Empréstimo,Resolvida,Cobrança Indevida
REC-2026-00021,2026-10-21,Banco Central,"Exijo solução imediata para falhas em minha conta corrente. Não havendo correção, acionarei Procon e processo judicial.",Conta Corrente,Em análise,Produto/Serviço
REC-2026-00022,2026-05-10,Redes Sociais,"Pegar empréstimo com vocês é mais fácil que arrumar sarna, só que pra pagar é que a coisa complica, né? Que beleza de 'ajuda'!",Empréstimo,Aberta,Produto/Serviço
REC-2026-00023,2026-10-23,SAC,"Meu atendimento do cartão hoje foi RIDÍCULO, estou em pânico e exijo que resolvam isso imediatamente para um cliente como eu!",Cartão de Crédito,Aberta,Atendimento
