id,data_reclamacao,canal,texto_reclamacao,produto,status,categoria_oculta_gabarito
REC-2026-00386,2026-09-28,SAC,"Atenção, Serviço de Atendimento ao Consumidor. Ou, como eu prefiro chamar, Serviço de Atendimento ao Caos.

Venho por meio deste, com a paciência que já se encontra em franco processo de falência, formalizar uma reclamação que transcende o absurdo e adentra o reino da pura má-fé. Refiro-me à persistente e absolutamente inexplicável cobrança indevida que a vossa instituição insiste em imputar ao meu nome. Não há produto associado, não há serviço contratado, não há NADA que justifique o débito que, com a precisão de um relógio suíço programado para roubar, aparece religiosamente em minhas supostas obrigações.

É fascinante observar a criatividade de vossas equipes em gerar débitos do nada. É uma arte, devo admitir. Uma arte de extorquir. Estamos falando de uma ""taxa"", um ""encargo"", um ""serviço genérico"" – a nomenclatura varia, mas o efeito é sempre o mesmo: um valor subtraído da minha carteira sem qualquer contrapartida. Já perdi a conta de quantas vezes tentei, ingenuamente, resolver esta aberração por meios ""amigáveis"". As horas desperdiçadas em vossas linhas telefônicas, aguardando por um atendente que mais parece um autômato recitando um roteiro pré-fabricado, já poderiam ter sido investidas na elaboração de um processo judicial robusto contra vossas práticas.

Cada protocolo gerado, cada promessa de ""análise"" que nunca se concretizou, cada ""senhor, sua solicitação foi encaminhada ao setor responsável"" que se dissolveu no éter da ineficiência, serve apenas para construir um dossiê robusto de vossa negligência e, ouso dizer, de vossa deliberada intenção de manter uma cobrança indevida. Parece que o lema de vossa empresa é ""se colar, colou"", na esperança de que o consumidor, exausto e desanimado, simplesmente desista e pague a conta do vosso delírio contábil. Pois bem, informo-lhes que este consumidor não se enquadra nessa categoria.

Portanto, deixo claro, com a mais absoluta formalidade e a mais sincera irritação: esta é a *última* e *definitiva* tentativa de resolução administrativa que farei. Não há espaço para mal-entendidos. Não há margem para novas ""análises"". Exijo o imediato estorno de todos os valores cobrados indevidamente, devidamente corrigidos e, mais importante, a cessação definitiva de qualquer futura cobrança referente a este *nada* que vocês insistem em me atribuir.

Caso esta demanda simples e direta não seja atendida com a celeridade e a seriedade que a situação exige, considerarei esgotadas todas as vias amigáveis. A partir desse momento, a conversa não será mais com o SAC, mas sim com instâncias onde a palavra ""cobrança indevida"" tem um peso jurídico considerável. Preparem-se para as devidas notificações junto ao PROCON, para a comunicação formal ao Banco Central sobre vossas práticas de mercado e, inevitavelmente, para uma ação judicial por repetição de indébito cumulada com pedido de indenização por danos morais, pelo tempo, pelo estresse e pela afronta à minha dignidade como consumidor. Os custos e os ônus processuais serão integralmente imputados à vossa instituição.

A bola está com vocês. Façam o que é correto e encerrem esta farsa. Ou preparem-se para as consequências legais de vossa obstinação em manter o que é manifestamente indevido. A escolha, agora, é inteiramente de vocês.",,Em análise,Cobrança Indevida
REC-2026-00387,2026-08-04,Banco Central,"Que palhaçada é essa de cobrança indevida no meu empréstimo? Se não arrumarem essa sujeira, vou pro Procon e depois direto com um processo!",Empréstimo,Resolvida,Cobrança Indevida
REC-2026-00388,2026-10-28,SAC,"Mas que inferno é esse de atendimento de vocês? Eu ligo pra tentar resolver a coisa do meu cartão e só me aparece uma tal de URA que não me entende! Fiquei um tempão no telefone, apertando número, e ninguém de verdade me atende, é assim que tratam a gente? É uma falta de vergonha essa palhaçada toda, quero que resolvam isso logo!",Cartão de Crédito,Aberta,Atendimento
REC-2026-00389,2026-09-17,Banco Central,"E aí, Banco Central. É pra vocês que a gente recorre quando a palhaçada dos bancos passa do limite, né? Porque olha, o que eu tô passando com o tal do empréstimo é de fazer qualquer um arrancar os cabelos. E não é pouco cabelo, não, viu? É a cabeleira toda indo embora de raiva.

Eu, um cidadão de bem, trabalhador, que rala o mês inteiro pra ter o mínimo, precisei de uma ajuda. Fui lá no banco, todo pimpão, me venderam um empréstimo pessoal com uns juros que, na hora do aperto, parecia até razoável. Assinei, o dinheiro caiu, vida que segue. Mas aí, a vida resolveu me dar uma rasteira e, por uma sorte do destino (ou azar, dependendo do ponto de vista), consegui arrumar o dinheiro pra quitar essa dívida antes do previsto. ""Que maravilha!"", pensei eu. ""Vou me livrar dessa bola de neve rapidinho."" Ingenuidade pura, minha gente. Pura e cristalina ingenuidade.

Liguei pro banco, todo feliz, pra pedir o cancelamento – ou, pra ser mais exato, a quitação antecipada, mas o que eu queria mesmo era anular essa porcaria da minha vida. Fiquei na fila, aquela musiquinha de elevador infernal, até que uma alma abençoada me atendeu. Expliquei a situação, toda didática. A atendente, com a voz mais monótona que já ouvi, disse que ""iria verificar"". Verificou, verificou, e a única coisa que verificou foi que eu estava perdendo meu tempo. ""Senhor, não consta nenhum pedido de cancelamento aqui."" Mas como não consta, minha filha? Se eu tô falando com você agora, e é justamente pra isso!

Não me dei por vencido, né? Brasileiro não desiste nunca, só se o banco for mais teimoso. Liguei de novo. Outra fila, outra musiquinha, outro ser humano do outro lado da linha. Dessa vez, a história foi diferente: ""Ah, sim, consta aqui que o senhor fez a solicitação, mas precisa aguardar um prazo de 10 dias úteis para a análise."" Dez dias úteis? Pra cancelar um empréstimo que eu peguei há menos de um mês? É sério isso? Parece que eles usam pombos-correio pra mandar as informações de um setor pro outro. Ou talvez esperem a lua ficar cheia pra processar o pedido.

Passaram-se os 10 dias úteis (que na vida real são uns 15 dias corridos, né? Porque final de semana não conta pra banco), e nada. Nem um e-mail, nem uma mensagem, nem um sinal de fumaça. Liguei de novo. Dessa vez, com a paciência lá no pé. Adivinhem? ""Senhor, não consta nenhuma solicitação de cancelamento. O senhor já tentou fazer isso pelo aplicativo?"" Pelo aplicativo? Eu já liguei duas vezes, perdi horas da minha vida no telefone, e agora me vêm com ""aplicativo""? Se fosse pra resolver pelo aplicativo, eu não estaria aqui falando com uma parede!

Aí a gente entra num ciclo vicioso que parece piada de mau gosto. Cada atendente conta uma história diferente. Um diz que ""não é possível cancelar"", só quitar com as parcelas já existentes. Outro diz que ""o sistema está fora do ar"". Outro jura de pés juntos que ""já foi encaminhado para o setor responsável e em breve entrarão em contato"". Entrarão em contato? Só se for pra me cobrar a próxima parcela, porque pra resolver meu problema, parece que ninguém tem pressa.

Enquanto isso, o relógio anda, os juros continuam correndo, e a minha paz de espírito, que já era pouca, virou pó. É um verdadeiro show de horrores. Parece que o objetivo é cansar o cliente, fazer a gente desistir de qualquer coisa que não seja pagar e ficar quieto. Será que é assim que a gente lida com o dinheiro das pessoas? Com essa falta de respeito, essa má vontade? É pra isso que serve o tal do ""relacionamento com o cliente""? Pra virar um calvário?

Então, Banco Central, eu tô aqui pra pedir que vocês deem uma olhada nessa palhaçada. É um empréstimo, não é a compra de um míssil nuclear. Por que é tão difícil cancelar uma coisa que eles facilitam tanto pra liberar? Essa enrolação toda só me faz pensar que tem algo de muito errado e que o banco está tirando vantagem da minha boa vontade – ou da minha falta de opção, no caso. Alguém precisa parar essa farra, porque a gente não é palhaço pra ficar aguentando isso não. É só o que me faltava.",Empréstimo,Resolvida,Cancelamento
REC-2026-00390,2026-07-25,SAC,"Exijo uma resolução imediata para as falhas inaceitáveis que afetam minha conta corrente. O nível de serviço que me tem sido dispensado está muito aquém do padrão esperado para um cliente da minha categoria. Não havendo uma correção ágil e eficaz, irei acionar o Banco Central e todas as instâncias judiciais pertinentes.",Conta Corrente,Resolvida,Produto/Serviço
REC-2026-00391,2026-02-12,Banco Central,"Ao Banco Central do Brasil,

Este expediente formaliza uma grave reclamação contra a instituição financeira Banco Forte S.A., CNPJ 11.222.333/0001-44, referente à conduta arbitrária e unilateral de cancelamento de conta corrente, em clara violação às normativas regulatórias vigentes e aos direitos do consumidor.

O Sr. Antônio Silva, titular da conta corrente nº 98765-4 na agência 2020 do Banco Forte S.A., mantém relacionamento com a referida instituição há mais de uma década. Durante todo este período, a conta sempre demonstrou movimentação regular e saudável, sem qualquer registro de inadimplência, irregularidade ou conduta que pudesse justificar uma rescisão unilateral por parte da instituição. A conta é essencial para o recebimento de proventos e para a gestão financeira diária do Sr. Silva, sendo um pilar fundamental em sua organização econômica e familiar. Jamais houve qualquer tipo de aviso prévio formal que indicasse a necessidade de qualquer regularização ou que houvesse interesse da instituição em findar o vínculo.

Em 20 de maio de 2024, o Sr. Silva foi surpreendido por uma notificação genérica, recebida por meio do aplicativo móvel do banco e subsequentemente por e-mail, informando o encerramento iminente de sua conta corrente. Esta comunicação, desprovida de fundamentação específica e sem qualquer demonstração de justa causa para a medida drástica, concedia um prazo exíguo e desproporcional de apenas quinze dias para a transferência de fundos e para a regularização de eventuais pendências inexistentes. Mais grave ainda, a notificação não apresentou qualquer motivação clara e legítima para o encerramento, limitando-se a invocar cláusulas contratuais genéricas que não se aplicam ao caso concreto do Sr. Silva, que sempre honrou com suas obrigações.

Imediatamente após o recebimento da notificação, o Sr. Silva buscou contato com o Banco Forte S.A. através de seus canais de atendimento, incluindo o Serviço de Atendimento ao Cliente (SAC) e a ouvidoria, sob os protocolos de atendimento 20240521-7890 e 20240523-1234. Em todas as interações, a resposta do banco foi evasiva e insatisfatória. Os atendentes limitaram-se a reiterar a decisão de encerramento, sem oferecer qualquer justificativa plausível ou sem apresentar uma solução que resguardasse os direitos do correntista. Não houve demonstração de análise individualizada do caso, nem tampouco abertura para negociação ou reversão da medida. A postura da instituição foi de intransigência absoluta, ignorando a relação de longa data e o impacto significativo da decisão sobre a vida financeira do cliente, que ficou impossibilitado de realizar transações essenciais e de receber seus vencimentos.

A conduta do Banco Forte S.A. configura uma flagrante violação ao artigo 12, inciso I, alínea ""c"", da Resolução CMN nº 4.753/2019, que estabelece a necessidade de prévio aviso, por escrito ou por meio eletrônico, com antecedência mínima de 30 (trinta) dias, informando os motivos da rescisão e a possibilidade de regularização de eventuais pendências. Mais do que isso, a referida norma e a jurisprudência consolidada exigem que o encerramento unilateral de conta corrente por parte da instituição financeira seja motivado por justa causa, devidamente comprovada e comunicada ao correntista, o que não ocorreu no presente caso. A ausência de uma justificativa clara e amparada por fatos concretos transforma a medida em um ato arbitrário, prejudicial ao consumidor e em desacordo com os princípios da boa-fé objetiva e da função social do contrato bancário.

A manutenção da conta corrente é um direito fundamental do consumidor que cumpre suas obrigações, e o encerramento unilateral, sem justa causa e sem o devido processo regulatório, causa prejuízos inestimáveis, incluindo a impossibilidade de recebimento de valores essenciais à subsistência, a necessidade de abertura de nova conta em outra instituição (com todas as burocracias e atrasos inerentes), e a desorganização de toda a vida financeira do Sr. Silva. A decisão do banco, além de desarrazoada, demonstra total desconsideração pela estabilidade financeira do cliente e pela confiança depositada na instituição ao longo de uma década.

Diante do exposto, requer-se a imediata intervenção do Banco Central do Brasil para que o Banco Forte S.A. seja compelido a reverter o cancelamento da conta corrente do Sr. Antônio Silva, restabelecendo integralmente o acesso aos serviços bancários, ou, alternativamente, que seja exigido do banco a apresentação de uma justificativa legalmente válida e que o processo de encerramento, caso se mostre inevitável, seja conduzido em estrita conformidade com as normas regulatórias, garantindo todos os direitos do correntista, em especial o prazo de aviso prévio e a possibilidade de regularização.

O Banco Central, na sua função de fiscalizador e regulador do sistema financeiro nacional, deve atuar para coibir tais práticas abusivas e garantir a observância das regras que visam proteger os consumidores e a integridade das relações bancárias. A omissão em coibir tais condutas abre precedente perigoso e desvirtua o propósito de um sistema financeiro justo e transparente.

Aguarda-se providências céleres e eficazes para a resolução desta pendência, em conformidade com as prerrogativas e deveres desta autarquia.",Conta Corrente,Aberta,Cancelamento
REC-2026-00392,2026-06-17,Redes Sociais,"QUE ABSURDO ESSE GOLPE DO EMPRÉSTIMO! Cês num tem vergonha na cara não de deixar isso acontecer? Tô mt puto com essa palhaçada de segurança de vcs, minha grana num é brincadeira. Arrumem essa bagunça agora, pq isso eh um descaso total!",Empréstimo,Resolvida,Fraude/Segurança
REC-2026-00393,2026-12-24,Redes Sociais,"Este atendimento deplorável é inadmissível. Exijo solução imediata para o CPF 123.456.789-00, ou as consequências legais serão inevitáveis.",,Resolvida,Atendimento
REC-2026-00394,2026-02-14,Redes Sociais,"É inacreditável a incompetência de vocês! Como assim tem uma fraude rolando na MINHA conta corrente? Eu sou cliente VIP, pago as taxas mais altas pra ter SEGURANÇA e esse tipo de coisa não pode acontecer. Resolvam AGORA ou eu simplesmente vou levar todo o meu dinheiro para um banco que realmente se importe com seus clientes de elite.",Conta Corrente,Aberta,Fraude/Segurança
REC-2026-00395,2026-12-08,Ouvidoria,Exijo a imediata remoção da cobrança indevida em meu cartão de crédito. A ausência de resolução imediata para este grave erro terá sérias implicações.,Cartão de Crédito,Aberta,Cobrança Indevida
REC-2026-00396,2026-09-12,Banco Central,"Banco Central pelo amor de deus me ajuda, o banco tá me cobrando uns negócio errado na minha conta corrente e tô desesperado, não sei o que faço!",Conta Corrente,Resolvida,Cobrança Indevida
REC-2026-00397,2026-07-10,Ouvidoria,"Que atendimento horrível pra empréstimo, sério? Ninguém resolve nada, tô sem paciência!",Empréstimo,Resolvida,Atendimento
REC-2026-00398,2026-06-21,Redes Sociais,"Meu, que raiva! Preciso desabafar e resolver essa parada de uma vez por todas pq ngm tá me dando solução. É o seguinte, eu to com um problema sério de segurança na minha conta e vcs nao tão nem aí.

Na madrugada de terça pra quarta, tipo umas 3 da manhã, meu cel apitou com uma notificação de PIX. Eu tava dormindo, nem vi na hora. Só fui acordar de manhã e a primeira coisa q faço é dar uma olhada no app do banco, como sempre. Puta merda! Tinha um PIX de R$ 800,00 que eu NAO FIZ saindo da minha conta. Pra um tal de ""João da Silva"", CPF desconhecido, num banco q eu nunca ouvi falar. Na hora meu coração disparou. 800 conto não é pouca coisa pra mim não!

Primeira coisa q fiz foi tentar ligar pro atendimento de vcs. MANO, fiquei uns 40 minutos na espera. QUARENTA MINUTOS! Com aquela musiquinha irritante tocando sem parar. Quando finalmente atenderam, a pessoa parecia q tava com sono, expliquei tudo, a moça pediu pra eu confirmar um monte de dado, e depois falou q eu tinha q abrir uma disputa pelo app. Pelo app! Eu ja tava no app vendo a cagada, óbvio q tentei por lá e nao consegui ou nao achei a opção certa na hora do desespero. Beleza, segui as instruções, abri a tal disputa, mandei print do extrato, tudo certinho.

Me deram um prazo de CINCO DIAS ÚTEIS pra analisarem. CINCO DIAS ÚTEIS! Sério? Enquanto isso, minha grana sumiu e eu tô aqui sem poder usar meu dinheiro. Eu tinha planejado usar essa grana pra pagar umas contas e comprar umas coisas importantes esse fim de semana, e agora? Quem vai arcar com isso? A sensação é de que minha conta é um queijo suíço, toda furada, e vcs nao tão fazendo nada pra consertar.

Isso é inaceitável! Como assim minha conta foi invadida e um PIX desse valor foi feito sem nenhuma confirmação extra? Sem biometria, sem reconhecimento facial, sem NADA? A segurança do banco de vcs é zero? Eu sempre usei esse banco, confiava, e agora to com medo de deixar meu dinheiro aí. Se não resolverem isso logo, eu vou ter que pensar seriamente em tirar minha grana daí e ir pra outro banco que realmente se importe com a segurança do cliente.

Eu quero meu dinheiro de volta e quero uma explicação DECENTE sobre como isso aconteceu e o que vcs vão fazer pra garantir que não aconteça de novo. Não dá pra ficar nessa de esperar sem ter notícia. Resolvam isso logo, por favor. É o mínimo q vcs podem fazer.",Conta Corrente,Em análise,Fraude/Segurança
REC-2026-00399,2026-02-09,Redes Sociais,"Ah, Redes Sociais! O único lugar que a gente consegue reclamar sem ter que digitar senha, token, senha de seis dígitos, senha de quatro dígitos, senha do cartão, senha da internet e mais um ""código de segurança"" que nunca chega. Pelo amor de Deus, gente! Vocês da empresa X, Y, Z (ou seja lá qual for o nome de vocês hoje, porque até isso muda mais que a previsão do tempo), precisam urgentemente de umas aulas de como não fazer a vida de um pobre idoso virar um inferno digital.

Eu sou o Adolfo. Adolfo da Silva. E a minha história com a tal ""conta corrente"" de vocês virou uma epopeia grega, só que sem heróis, só com um velho confuso e um aplicativo que parece ter sido desenhado por um gênio do mal. Veja bem, eu até tento. Juro que tento. Comprei meu smartphone lá na loja do shopping, que o vendedor me garantiu que era ""fácil de usar"". Fácil de usar o escambau! Mais fácil é montar um foguete pra Lua com um manual em mandarim.

Acontece que, semana passada, eu fui tentar fazer uma coisa simples, sabe? Coisa de gente normal: ver o meu saldo. O saldo, gente! Não é pra mandar dinheiro pra Marte, não é pra comprar bitcoin, é só pra saber se ainda tem dinheiro pra pagar a conta de luz. Abri o tal do aplicativo, aquele que vive mudando de cara. Uma hora é azul, outra hora é verde, outra hora tem uns bonequinhos dançando. Parecem que não se decidem nunca! E cada vez que muda, os botões somem de lugar. É um tal de ""saldo aqui"", ""extrato ali"", ""pagamentos acolá"", que eu fico mais perdido que cego em tiroteio.

Pois bem, depois de uns vinte minutos procurando, e quase jogando o aparelho na parede, achei o botão de ""saldo"". Cliquei. E o que aconteceu? Nada! Uma tela branca. Aí eu fechei, abri de novo, reiniciei o telefone, contei até dez, contei até cem, rezei uns Pai Nossos. Nada! A mesma tela branca me encarando, como se estivesse zombando da minha cara. ""Você não tem saldo, vovô, nem cérebro pra achar!"", parecia que o telefone tava pensando.

Aí, a saga continua. Pensei: ""Vou ligar lá no tal do SAC"". Santa ingenuidade a minha! Liguei. Primeira coisa: ""Digite seu CPF"". Digitei. ""Agora, digite a sua senha de quatro dígitos"". Digitei. ""Agora, digite a senha da internet de seis dígitos"". Digitei. ""Para sua segurança, por favor, digite o token que foi enviado para o seu celular"". O token? Que token? Onde é que pega esse raio de token? Procurei no WhatsApp, no SMS, no e-mail, até no meu bolso, vai que tinha caído lá. Nada! Aí o robô, com aquela voz melosa de quem acabou de sair de um comercial de margarina, me diz: ""Não foi possível identificar o token. Por favor, tente novamente"". E desligou na minha cara! Desligou! Como se eu fosse um idiota que não sabe digitar número!

Eu juro que se fosse o tempo do banco de antigamente, eu já tinha ido lá, sentado na cadeira do gerente, e resolvido essa bagunça em cinco minutos, tomando um cafezinho. Agora, é só robô, aplicativo que não funciona, e tela branca. E a conta de luz vencendo. E eu aqui, sem saber se tenho dinheiro ou se estou com a conta negativa porque o sistema de vocês resolveu fazer greve justo na minha vez.

É um absurdo! A gente paga por um serviço que, teoricamente, é para facilitar a vida, e o que a gente ganha é dor de cabeça, cabelo branco (que já tenho de monte, diga-se de passagem) e a sensação de que estamos todos virando números em um sistema que ninguém entende de verdade. Vocês deveriam fazer um aplicativo que funcionasse de verdade, para gente de verdade, não para esses gênios da computação que não têm mais o que fazer e ficam mudando as coisas de lugar a cada duas semanas.

Será que é pedir demais pra ter um botão escrito ""Meu Saldo"" que realmente mostre o saldo? Ou um telefone que a gente liga e fala com uma pessoa de carne e osso, que entenda a nossa agonia? Acho que estou pedindo demais para essa ""era digital"" de vocês. Me sinto um dinossauro tentando usar um skate elétrico. E o skate, claro, está sem bateria.

Ah, e não adianta me mandar mensagem automática pra falar que ""estão trabalhando para melhorar a experiência"". Já ouvi essa ladainha antes. Melhorar pra quem? Pra mim, só piora!",Conta Corrente,Em análise,Produto/Serviço
